<?xml version="1.0" encoding="utf-8"?>
<scene xmlns:xs="http://www.w3.org/2001/XMLSchema-instance" xs:noNamespaceSchemaLocation="scene-def.xsd"
	id="0" bgimg="ff.jpg" bgm="03.wma">
   <!-- 贴张图 -->
   <section id="0">
       <img x="0" y="0" width="640" height="480">1/1.jpg</img>
       <say speaker="loli">
		姐，这把刀给你
	   </say>
       <sound>sakura.mp3</sound>
   </section>
	<section id="1">
		<img x="0" y="0" width="640" height="480">1/2.jpg</img>
		<say speaker="翠神">
		为啥？
		</say>
	</section>
	<section id="2">
		<img x="0" y="0" width="640" height="480">1/3.jpg</img>
		<say speaker="loli">
		没啥，天天看你用木头练刀觉得傻乎乎的
		</say>
		<sound>sakura.mp3</sound>
	</section>
	<section id="3">
		<img x="0" y="0" width="640" height="480">1/4.jpg</img>
		<say speaker="翠神">
		其实私有刀的，不过上次祭祀的时候掉湖里了
		</say>
	</section>
	<section id="4">
		<img x="0" y="0" width="640" height="480">1/4.jpg</img>
		<say speaker="翠神">
		要不你帮姐捞出来吧
		</say>
	</section>
	<section id="5">
		<img x="0" y="0" width="640" height="480">1/5.jpg</img>
		<say speaker="loli">
		私忽然想起私还没睡饱，老姐bye bye，私睡觉去了
		</say>
	</section>
	<section id="6">
       <gotoscene>scene3</gotoscene>
   </section>
</scene>
